dpo_idx,max_similarity,ngram_match,status,text_snippet
2643,0.39812782406806946,False,KEPT,"We have a downed offshore oil rig in the Gulf—critical turbine failure. The replacement part (a 7,20"
2644,0.3669009506702423,False,KEPT,"We've got a live incident: our EDR is down in one of the regional offices due to a failed patch, but"
2645,0.5167312026023865,False,KEPT,We just had a chemical release in the Louisville plant. The alarm logs show a valve failure on Tank 
2646,0.4500458240509033,False,KEPT,We got a call 90 minutes ago—OSHA is showing up at our warehouse in 3 hours for an 'unannounced insp
2647,0.27510789036750793,False,KEPT,My garbage disposal is completely jammed and making this terrifying grinding noise every time I try 
2648,0.4345530569553375,False,KEPT,We just got served with a federal subpoena demanding the complete chat history of a user from our en
2649,0.3968352675437927,False,KEPT,We just had a Level 1 SEV called at 3 AM. Our edge router in Frankfurt accidentally advertised our e
2650,0.32032060623168945,False,KEPT,"The wedding is happening NOW. It just started pouring rain — like, monsoon-level. We have 120 guests"
2651,0.3673965036869049,False,KEPT,We are in the middle of peak holiday season and have zero air freight capacity booked for our holida
2652,0.3150583505630493,False,KEPT,We found a suspicious binary called 'svch0st' in /tmp on our primary database server. It’s not signe
2653,0.37344786524772644,False,KEPT,I'm trying to fix my audio engineer's favorite studio headphones — the left channel cut out because 
2654,0.413347065448761,False,KEPT,"We're in a company-wide hiring freeze due to investor pressure, but I have two critical projects: Pr"
2655,0.37462204694747925,False,KEPT,"We're in the middle of a critical system migration, and our lead engineer just burned out—called in "
2656,0.4581174850463867,False,KEPT,"We're in month three of a company-wide hiring freeze due to investor pressure, but I have two missio"
2657,0.4227980673313141,False,KEPT,We've got a full company all-hands in 90 minutes. There's a rumor spreading through Slack and email 
2658,0.3964077830314636,False,KEPT,We just confirmed a supply chain compromise: the 'log4j-utils' package our entire backend depends on
2659,0.422688752412796,False,KEPT,I'm the incident commander at a regional hospital. We're 90 minutes into a ransomware attack that ha
2660,0.36806684732437134,False,KEPT,We have a critical shortage of refrigerated trucking capacity this weekend due to a regional Teamste
2661,0.3377266526222229,False,KEPT,"URGENT: My car's driver-side headlight is out, and I need to replace the bulb before my night shift "
2662,0.4936875104904175,False,KEPT,"Our top sales executive, Sarah, just closed a $12M deal with a major client. Two days later, the cli"
2663,0.3550594747066498,False,KEPT,"We just had a security breach where an attacker exfiltrated our user database, including bcrypt-hash"
2664,0.5120882987976074,False,KEPT,"I'm the Head of HR at a mid-sized tech firm. One of our top sales VPs, who brought in 40% of last qu"
2665,0.2790479362010956,False,KEPT,"We're having a total meltdown on the factory floor network—machines are disconnecting, PLCs are timi"
2666,0.3267185688018799,False,KEPT,"I'm a junior sysadmin at a manufacturing plant, and the AS/400 that controls the warehouse inventory"
2667,0.47301584482192993,False,KEPT,We had a 500-gallon diesel spill at our distribution center in rural Nebraska. The local fire depart
2668,0.34594112634658813,False,KEPT,We just confirmed our root code-signing key was compromised in a supply chain breach. Attackers used
2669,0.4929083287715912,False,KEPT,We're under investigation by the EEOC for our AI-powered hiring tool that shows a 38% lower callback
2670,0.27675217390060425,False,KEPT,I'm trying to set up a cheap home security system using two old Android phones I have lying around. 
2671,0.43423235416412354,False,KEPT,"We're 90 minutes into a live awards ceremony, and one of our A-list winners got completely drunk dur"
2672,0.3998446464538574,False,KEPT,"I'm a mid-level compliance officer at a fintech startup. Last week, I discovered that the CFO is usi"
2673,0.4129006564617157,False,KEPT,We just discovered a 40% inventory discrepancy in our WMS for the 'NovaGlow' smart mirror—the flagsh
2674,0.4068452715873718,False,KEPT,We've discovered that 3% of the 'MicroTemp 5000' temperature sensors in our medical devices are coun
2675,0.24567389488220215,False,KEPT,We've got a critical Java 6 middleware server running a core financial settlement system. Security f
2676,0.4478197693824768,False,KEPT,Our public-facing university homepage just got defaced with a ransom message. I'm the IT director. T
2677,0.37890753149986267,False,KEPT,My job is literally on the line. It's peak holiday season and every air cargo carrier is booked soli
2678,0.39728403091430664,False,KEPT,"We're about to open gates for our 50,000-capacity music festival in downtown Atlanta, and the headli"
2679,0.3016744554042816,False,KEPT,Our monitoring system just flagged that the 'data-ingestd' daemon on our legacy RHEL 5.11 server (ke
2680,0.4700339436531067,False,KEPT,We have a chemical drum labeled 'Corrosive - Sulfuric Acid (UN1830)' that ruptured in our temperatur
2681,0.39945873618125916,False,KEPT,"We just discovered that one of our board members, who voted to approve a $10M contract with 'NexaLog"
2682,0.32227760553359985,False,KEPT,"We're 15 minutes into a live esports finals broadcast at a major arena, and the entire venue just lo"
2683,0.42933905124664307,False,KEPT,"We had a ransomware attack hit our domain controller (DC) last night. Encryption is widespread, but "
2684,0.5358291864395142,False,KEPT,I just found out our flagship product failed its final safety certification test—an obscure but mand
2685,0.3794651925563812,False,KEPT,"My job is literally on the line. We have 36 hours to get 5,000 units of the 'X-22 Controller' from o"
2686,0.342134028673172,False,KEPT,"I'm on the side of a highway at night, rain coming down hard, and I just blew a headlight. My servic"
2687,0.395191490650177,False,KEPT,"URGENT: We’re facing a plant shutdown in Ohio in 36 hours because we’re missing 5,000 units of the '"
2688,0.3662179708480835,False,KEPT,"We're 90 minutes from the start of the city's annual marathon, and a multi-vehicle accident has comp"
2689,0.3013479709625244,False,KEPT,URGENT: My kid slammed the door so hard the doorknob punched through the drywall in the hallway. It'
2690,0.3096262812614441,False,KEPT,I'm stranded in a parking lot at night with a blown passenger-side headlight on my 2017 Honda Accord
2691,0.320454478263855,False,KEPT,We just had a junior DBA accidentally drop the entire production 'customer_orders' schema in our 15-
2692,0.24317783117294312,False,KEPT,I’ve got an old Android phone sitting in a drawer and I want to turn it into a security camera for m
2693,0.4013267755508423,False,KEPT,We just got an FDA warning letter for our AI mental health chatbot 'CalmMind' that's used by 2 milli
2694,0.41380804777145386,False,KEPT,We just detected suspicious lateral movement in our corporate network using Zeek/Bro flow logs. The 
2695,0.37781524658203125,False,KEPT,We just found a critical error in our Q3 financials 90 minutes before the earnings call. The Control
2696,0.5464069247245789,False,KEPT,We just had a forklift tip over in our warehouse and rupture a 55-gallon drum of 'Solvent X-99'—a fl
2697,0.35085850954055786,False,KEPT,We found a suspicious binary named 'svch0st' running under System privileges on our primary domain c
2698,0.38278716802597046,False,KEPT,The lead COBOL developer who maintained our bank's core payment gateway just quit without notice. We
2699,0.3264694809913635,False,KEPT,"My dining table leg just cracked during a dinner party with 12 guests. It's wobbling badly, and I ca"
2700,0.46626168489456177,False,KEPT,"My job is on the line. Our API went down for 4 hours last night during peak trading hours, and one o"
2701,0.370529443025589,False,KEPT,My job is literally on the line. We have a refrigerated cargo ship (Reefer Vessel 'OceanFreeze-7') c
2702,0.3282967209815979,False,KEPT,"My ceiling fan in the living room has started flickering and making a buzzing noise, and now there's"
2703,0.6334375143051147,False,REMOVED,"We just hosted a corporate gala for 300 VIP clients at a luxury hotel. Within two hours, 42 guests h"
2704,0.3872820734977722,False,KEPT,"We're having our quarterly all-hands tomorrow, and a rumor has exploded on Slack that we're doing ma"
2705,0.4707863926887512,False,KEPT,We just got an FDA warning letter saying our AI dermatology app is an uncleared medical device becau
2706,0.29468291997909546,False,KEPT,We just discovered that our root code-signing certificate (used to sign all app updates for our 8 mi
2707,0.38254472613334656,False,KEPT,"It's my best friend's wedding, and I'm the wedding planner. We're at a beautiful outdoor garden venu"
2708,0.24454964697360992,False,KEPT,Our production PostgreSQL 11 database just crashed because the main index on the 'transactions' tabl
2709,0.34068530797958374,False,KEPT,Our e-commerce platform just failed a PCI-DSS audit because we're running an unpatched version of Op
2710,0.39989161491394043,False,KEPT,I'm a mid-level compliance officer at a fintech startup. I discovered that our CEO is using a shell 
2711,0.4461832642555237,False,KEPT,We just got word that our sole-source supplier for specialty polymer resin (used in 80% of our produ
2712,0.4287903308868408,False,KEPT,I'm hanging a 40-pound mirror on drywall in my boss's office and I don't have a stud finder or wall 
2713,0.48491454124450684,False,KEPT,We just discovered a material error in our Q3 financials 12 hours before the earnings call. The cont
2714,0.35248708724975586,False,KEPT,"My job is literally on the line. We need to get 5,000 units of the 'X-22 Controller' from Taipei (TP"
2715,0.5160008668899536,False,KEPT,"I'm the VP of Finance at a public company. We're 90 minutes from the Q3 earnings call, and I just di"
2716,0.49206453561782837,False,KEPT,"We just discovered a data breach affecting 50,000 customers — unauthorized access to names, email ad"
2717,0.3781713843345642,False,KEPT,We just discovered a zero-day vulnerability in our cloud infrastructure that could allow full root a
2718,0.3984394967556,False,KEPT,"We're 72 hours from a mandatory SOC 2 Type II audit for our crypto exchange, and I just discovered o"
2719,0.552458643913269,False,REMOVED,We're a premium skincare brand and just got a 1-star review on our homepage that's gone viral intern
2720,0.48645105957984924,False,KEPT,I'm the head of platform integrity at a crypto exchange that just got hit with a regulatory audit no
2721,0.4809609055519104,False,KEPT,We had a 4-hour API outage last night that completely took down our biggest partner's e-commerce sit
2722,0.333061546087265,False,KEPT,I'm the head of security at a cloud provider. We just discovered a zero-day vulnerability in our cor
2723,0.3907032310962677,False,KEPT,We just had a surprise 20% headcount cut in the product engineering org. The CEO wants to announce a
2724,0.3448624610900879,False,KEPT,We've got a confirmed data leak in our R&D division—someone's exfiltrating proprietary AI training d
2725,0.3390468657016754,False,KEPT,My job is on the line because the main turbine on our offshore Gulf of Mexico rig just failed. We ha
2726,0.4990454614162445,False,KEPT,"I'm the head of IT security at a mid-sized fintech firm. Ten minutes ago, the CEO clicked a phishing"
2727,0.3495810627937317,False,KEPT,We’re facing a total shutdown of our Denver manufacturing line in 36 hours because a critical batch 
2728,0.35862866044044495,False,KEPT,"We had a full domain compromise last night. Attacker had DA, we found Golden Tickets and evidence of"
2729,0.31493306159973145,False,KEPT,"I'm stuck in my tent in the middle of a downpour in the Pacific Northwest, and the main zipper just "
2730,0.4588536024093628,False,KEPT,"We're live-streaming a major tech summit with 50,000 virtual attendees and a packed house. During th"
2731,0.4186490774154663,False,KEPT,We're in the middle of a polar vortex. The temp dropped to -20°F last night and now the basement pip
2732,0.43659842014312744,False,KEPT,Our CEO just clicked on a phishing email and entered his Microsoft 365 credentials on a fake login p
2733,0.3351990580558777,False,KEPT,We just got served with a federal subpoena for encrypted user data from a 2021 breach investigation.
2734,0.4026477038860321,False,KEPT,"We just had a 20% headcount cut in the product engineering org, and now we have to delay the flagshi"
2735,0.4085425138473511,False,KEPT,"We're hosting a music festival with 50,000 attendees. A 7-year-old child has gone missing near the m"
2736,0.41979849338531494,False,KEPT,My job is on the line. We've confirmed that the Building 4 HVAC controller (an IoT device running em
2737,0.33779042959213257,False,KEPT,We are in the middle of peak holiday season and every air freight lane out of Asia is completely boo
2738,0.4715973734855652,False,KEPT,"I'm a senior engineer at a medical device startup. We're about to launch a new insulin pump, but I d"
2739,0.3763410151004791,False,KEPT,"We've been pushing a hybrid remote-work model for 18 months, and productivity is up 22% with turnove"
2740,0.3447316884994507,False,KEPT,URGENT: My dishwasher is leaking all over the kitchen floor and I can't find the shut-off valve key.
2741,0.43950754404067993,False,KEPT,We have a critical delivery of temperature-sensitive biologics that must reach a cancer research lab
2742,0.4156443476676941,False,KEPT,"We just received a shipment of 10,000 doses of a temperature-sensitive mRNA vaccine from a supplier "
2743,0.3265802562236786,False,KEPT,"My keys are locked in the car — driver's side window slightly cracked open, about half an inch. I've"
2744,0.4051530659198761,False,KEPT,"We've just received a federal subpoena demanding the unencrypted personal data of 50,000 users from "
2745,0.4359601140022278,False,KEPT,"We're two weeks from closing a $400M acquisition by a major tech firm, and our security team just co"
2746,0.38495874404907227,False,KEPT,"We're 90 minutes from the start of the city marathon, and a multi-vehicle accident has completely bl"
2747,0.3051711916923523,False,KEPT,We're in a crisis: our core inventory management system — a 20-year-old Windows app written in Visua
2748,0.3086632788181305,False,KEPT,We're running a critical C++ monitoring daemon on an old RHEL 5.11 server with a 2.6.18 kernel—no ch
2749,0.46173617243766785,False,KEPT,We have a crisis: a refrigerated truck carrying $1.2M worth of temperature-sensitive mRNA vaccines (
2750,0.6521932482719421,False,REMOVED,"We just hosted a corporate gala for 200 VIP clients and executives. Within 90 minutes, 42 guests hav"
2751,0.3390221893787384,False,KEPT,We're 30 minutes from the ceremony and it just started pouring rain at the outdoor wedding venue. We
2752,0.3132058382034302,False,KEPT,My dishwasher is spraying water all over the kitchen floor because the door seal blew out mid-cycle.
2753,0.5926729440689087,False,REMOVED,We're in the middle of a corporate gala dinner for 300 VIPs when 12 people suddenly get sick with na
2754,0.42891982197761536,False,KEPT,The lead developer who wrote our core COBOL payment gateway just quit—stormed out after a fight with
2755,0.4833161532878876,False,KEPT,We have a massive problem with the Henderson account. The client's production line has been down for
2756,0.4174754023551941,False,KEPT,"We're 90 minutes from the start of the city marathon, and a multi-vehicle pileup just shut down Main"
2757,0.3652094006538391,False,KEPT,My team pulled an all-nighter to deliver a client presentation that saved a $2M account. We got the 
2758,0.39833590388298035,False,KEPT,I'm the lead security engineer at a healthcare SaaS company. We just discovered a zero-day vulnerabi
2759,0.42937901616096497,False,KEPT,"My supplier for specialty aerospace-grade resins just filed for bankruptcy, and they're holding $1.8"
2760,0.3879874646663666,False,KEPT,We've just detected signs of lateral movement in our corporate network through anomalous NetFlow log
2761,0.370542049407959,False,KEPT,I'm the VP of Product at a SaaS startup. The CEO just announced a 20% headcount cut across engineeri
2762,0.29725730419158936,False,KEPT,My job is literally on the line. We're trying to restore critical financial data from a 15-year-old 
2763,0.48435044288635254,False,KEPT,"We just announced a keynote speaker for our tech conference, and within an hour, Twitter exploded. T"
2764,0.42679673433303833,False,KEPT,We have an offshore oil rig in the Gulf of Mexico that just suffered a critical turbine failure. The
2765,0.3602064847946167,False,KEPT,"We're 90 minutes into a music festival with 50,000 people when a 7-year-old girl is reported missing"
2766,0.4356209635734558,False,KEPT,"We're 72 hours from a FINRA and SEC joint audit for our crypto exchange license application, and we "
2767,0.3518637418746948,False,KEPT,We’re in the middle of peak holiday season and all air cargo carriers have zero capacity booked out 
2768,0.5777108073234558,False,REMOVED,I'm the event operations lead for a major tech company's annual investor gala. We just got word from
2769,0.3445810079574585,False,KEPT,My boss just called me into the office and said if I don't get the delivery van's headlight fixed in
2770,0.34098318219184875,False,KEPT,We're having a full-blown multicast storm on our factory floor network right now. The PLCs are dropp
2771,0.3510426878929138,False,KEPT,We have a last-minute order for 8 tons of perishable vaccine doses that must leave Brussels (BRU) to
2772,0.4253491461277008,False,KEPT,We just got a whistleblower report in our Indonesia subsidiary alleging that our local sales directo
2773,0.327013224363327,False,KEPT,My job is literally on the line. The North Sea Titan oil rig just had a turbine failure and needs a 
2774,0.21848154067993164,False,KEPT,We have a mission-critical customer billing system running on a monolithic PHP 5.3 application stack
2775,0.3206649422645569,False,KEPT,My job is on the line. We're loading a Boeing 757F for a transatlantic cargo flight from Newark (EWR
2776,0.39210832118988037,False,KEPT,"My job is literally on the line. I'm the procurement lead for a $2M/year SaaS platform renewal, and "
2777,0.4494081735610962,False,KEPT,"We're 2 hours into a high-profile charity gala, and one of our VIP donors—someone who single-handedl"
2778,0.40942299365997314,False,KEPT,We've detected anomalous SMB traffic in our flow logs showing lateral movement across internal subne
2779,0.3474085330963135,False,KEPT,We've got a zero-day RCE (Remote Code Execution) exploit actively being used against our customer po
2780,0.34086593985557556,False,KEPT,My job is on the line because I'm leading the renewal of a critical SaaS contract with a vendor we'v
2781,0.4770028591156006,False,KEPT,"We're a social media platform for creators, and we just got a warning from the FTC about COPPA compl"
2782,0.24418438971042633,False,KEPT,"My home security system just got canceled because the provider went out of business, and I can't aff"
2783,0.31764790415763855,False,KEPT,We just discovered that one of our core production microservices was compromised through a supply ch
2784,0.3869503140449524,False,KEPT,"We have a refrigerated cargo ship (reefer vessel) carrying 12,000 pallets of temperature-sensitive p"
2785,0.2851736545562744,False,KEPT,"My garbage disposal just started making a horrible grinding noise when I turn it on, and now it won’"
2786,0.3770157992839813,False,KEPT,My job is on the line because I have to fix a clogged garbage disposal that's making a loud grinding
2787,0.36340662837028503,False,KEPT,I'm hanging a massive 50-pound mirror in my living room and just realized there's no stud where I wa
2788,0.30450382828712463,False,KEPT,My kid slammed the bedroom door so hard the knob punched a softball-sized hole in the drywall. Landl
2789,0.5031951665878296,False,KEPT,"We just announced Dr. Lena Voss, a 'free speech absolutist' neuroscientist, as our keynote speaker f"
2790,0.5329277515411377,False,KEPT,"We're 2 hours from opening gates at our 40,000-capacity music festival and the headliner just called"
2791,0.39078718423843384,False,KEPT,"My job is on the line. We have a shipment of 10,000 units of temperature-sensitive monoclonal antibo"
2792,0.46331286430358887,False,KEPT,We just got a whistleblower email from an employee in our Jakarta subsidiary. They claim our regiona
2793,0.38427531719207764,False,KEPT,We're 5 minutes from the keynote at a major tech conference and the main projector just died. The sp
2794,0.30141139030456543,False,KEPT,"Our AS/400 is frozen—no response on the physical console, jobs are hanging, and we're 4 hours into a"
2795,0.4002455174922943,False,KEPT,We just got the lab report back: our 'SmartBuddy' kids' smartwatch fails the latest FCC SAR radiatio
2796,0.35593265295028687,False,KEPT,"We're 12 minutes into a live esports finals broadcast for a $2M tournament, and the entire arena jus"
2797,0.3519322872161865,False,KEPT,We found a suspicious binary named 'svch0st' in /tmp on our primary database server. It's not signed
2798,0.32734695076942444,False,KEPT,We're under a massive credential stuffing attack right now—over 2 million login attempts in the last
2799,0.3268062472343445,False,KEPT,I'm stranded on a remote mountain road at night. My car battery is dead and the terminals are comple
2800,0.352059930562973,False,KEPT,My team spent six months building a customer segmentation model that just got presented at the execu
2801,0.41856127977371216,False,KEPT,"We're three weeks away from closing a $400M acquisition by a major tech firm, and I just got flagged"
2802,0.3017299175262451,False,KEPT,"It's 2 AM, pouring rain, and the main zipper on our family tent just jammed halfway up. We're all so"
2803,0.36942073702812195,False,KEPT,"My job is on the line because we're shipping 5,000 units of the X-22 Controller from Taiwan to Ohio "
2804,0.37371551990509033,False,KEPT,URGENT: My toilet just started running non-stop and I opened the tank to find the flapper chain is c
2805,0.3592328429222107,False,KEPT,Our SOC just flagged that the domain admin account 'svc-backup' has been active from an IP in Moscow
2806,0.4129432439804077,False,KEPT,"We're in deep trouble. One of our board members, who chairs the audit committee, also owns 45% of ou"
2807,0.3728553056716919,False,KEPT,"We just caught a massive labeling error on 10,000 units of 'BioGel Wound Sealant'—the batch number i"
2808,0.4243760406970978,False,KEPT,We've got a Level 1 incident: one of our smart HVAC controllers (IoT device) in the downtown office 
2809,0.4836469292640686,False,KEPT,I'm the head of HR tech at a mid-sized firm. We've been using an AI-driven resume screening tool for
2810,0.39493274688720703,False,KEPT,We've discovered a zero-day vulnerability in a widely used industrial control system (ICS) that coul
2811,0.47641444206237793,False,KEPT,We're in crisis mode. Our core SAP system just froze because of a deadlock in the main transaction t
2812,0.5155030488967896,False,KEPT,We just got hit with a Class I recall notice from the CPSC for our 'SparkleBuds' interactive toy aft
2813,0.33408406376838684,False,KEPT,I'm the head of engineering at a mid-sized fintech. The CEO personally referred his nephew for a sen
2814,0.47894972562789917,False,KEPT,"We just announced a keynote speaker for our annual tech conference, and within 4 hours, Twitter is o"
2815,0.3839765787124634,False,KEPT,We're 90 minutes into a ransomware attack that has encrypted our primary patient database. The EHR i
2816,0.3494283854961395,False,KEPT,I'm the Head of HR at a 10-year-old tech firm that just brought in a new CEO from a traditional manu
2817,0.32402974367141724,False,KEPT,The bride is about to walk down the aisle in an outdoor garden ceremony and it just started pouring.
2818,0.4543631970882416,False,KEPT,"Our API had a 12-hour outage last night. One of our biggest partners, FinTrust Inc., is furious — th"
2819,0.3403589129447937,False,KEPT,"We're in the middle of a critical project to migrate our customer data to a new CRM, and my team lea"
2820,0.32130685448646545,False,KEPT,My job is on the line because our core billing daemon on a legacy Red Hat 5.4 system keeps crashing 
2821,0.44418442249298096,False,KEPT,We have a refrigerated truck en route from Denver to Minneapolis carrying $380k worth of temperature
2822,0.34903016686439514,False,KEPT,"We are 5 minutes away from the CEO's keynote at our annual sales conference, and the main stage proj"
2823,0.4392380714416504,False,KEPT,My basement pipe just froze overnight—no water pressure upstairs. I’ve got a hair dryer and 90 minut
2824,0.40510427951812744,False,KEPT,"We have a shipment of 10,000 temperature-sensitive insulin vials stuck at Frankfurt Airport customs."
2825,0.46396124362945557,False,KEPT,We had a 400-gallon diesel spill at our distribution center in rural Nebraska this morning. It breac
2826,0.43336623907089233,False,KEPT,We've got a nightmare on our hands. A truck carrying $1.2M worth of temperature-sensitive mRNA vacci
2827,0.30498504638671875,False,KEPT,We're 12 minutes into a live broadcast of the Apex Legends Global Series qualifier at the Atlanta Es
2828,0.3260028660297394,False,KEPT,We've detected anomalous outbound traffic from our R&D network during off-hours. The data volume is 
2829,0.4123994708061218,False,KEPT,"URGENT: I just spilled an entire bottle of red wine on my white living room carpet—like, it's soaked"
2830,0.39053645730018616,False,KEPT,My boss just called me into his office and said if I don't fix the flickering ceiling fan in the con
