dpo_idx,max_similarity,ngram_match,status,text_snippet
1327,0.4034571647644043,False,KEPT,We've got a critical server rack in our main data center—runs the order processing system for our e-
1328,0.2850905656814575,False,KEPT,We've got a zero-day vulnerability alert on our Java 6-based middleware stack that processes all cus
1329,0.3766624629497528,False,KEPT,I'm a senior engineering manager at a fintech startup. Our CTO built the company's original backend 
1330,0.368719220161438,False,KEPT,"I'm managing the logistics for a city marathon with 15,000 runners. 45 minutes before the start, a m"
1331,0.33678412437438965,False,KEPT,"Our building's central HVAC system just went haywire—temperature spikes, fans running at max, CO2 le"
1332,0.3604763448238373,False,KEPT,My job is on the line. Our core monitoring daemon—a C++ process running on a legacy RHEL 5.11 server
1333,0.43251851201057434,False,KEPT,Our largest supplier of specialty polymers just filed for Chapter 11 bankruptcy. We had already paid
1334,0.4326915740966797,False,KEPT,"I'm the head of security at a 10,000-person tech conference. The fire alarm just went off in the mai"
1335,0.3831884264945984,False,KEPT,We've detected anomalous login activity on a domain administrator account – logins from an unexpecte
1336,0.4534788727760315,False,KEPT,We just got a call—OSHA is showing up unannounced tomorrow morning at 8 AM for a full facility inspe
1337,0.2663114666938782,False,KEPT,"We're under active attack right now—within the last 15 minutes, a zero-day exploit in our Node.js we"
1338,0.3473539352416992,False,KEPT,I'm the procurement lead on a critical SaaS renewal for our CRM platform. The vendor we've used for 
1339,0.42137610912323,False,KEPT,We have a container with 300 prototype units of our new AR glasses (worth $4.2M) that was supposed t
1340,0.308860719203949,False,KEPT,We're under a massive DDoS attack right now—our primary load balancer is getting hammered with 2.3 T
1341,0.3784372806549072,False,KEPT,My team spent 3 months building a machine learning model that reduced customer churn by 37%. We docu
1342,0.25365737080574036,False,KEPT,Our only branch office in rural Montana just lost all connectivity. The site manager says the router
1343,0.29830238223075867,False,KEPT,We’re running a mission-critical inventory system from 1998 that the original vendor dissolved in 20
1344,0.40771484375,False,KEPT,"I'm stranded on a rural road at 2 AM. My car battery is dead, the terminals are covered in white cru"
1345,0.36805039644241333,False,KEPT,My job is on the line. The CEO just sent a company-wide email saying 'We need bodies in seats' and t
1346,0.3032212555408478,False,KEPT,I just twisted my wrist bad last week and the doctor said no heavy gripping or twisting for another 
1347,0.49186015129089355,False,KEPT,We had a 400-gallon diesel spill at our distribution center in rural Nebraska last night. The local 
1348,0.23265117406845093,False,KEPT,My job is on the line. Our production PostgreSQL 12 database has a corrupted GIN index on the 'searc
1349,0.3980349898338318,False,KEPT,"I'm the lead producer for a 50,000-person music festival. The headliner just canceled — no-show, no "
1350,0.31972599029541016,False,KEPT,"We have a production Linux server that's completely locked down — I can't access root, and my sudo i"
1351,0.3966820240020752,False,KEPT,"My lead data scientist, who's the only person who understands our core recommendation engine, just g"
1352,0.3572034239768982,False,KEPT,URGENT: I'm assembling a bookshelf and one of the corner screws is completely stripped—head is chewe
1353,0.43811750411987305,False,KEPT,"We're in a company-wide hiring freeze, but my AI product launch team needs a machine learning engine"
1354,0.32598310708999634,False,KEPT,We just had a ransomware attack hit our primary domain controller (DC) at 2 AM. It's encrypted and d
1355,0.3116888999938965,False,KEPT,We just received a valid GDPR 'Right to be Forgotten' request from a customer who was also a directo
1356,0.39123135805130005,False,KEPT,My job is on the line because we're blocked from running a mission-critical legacy inventory system 
1357,0.3440059721469879,False,KEPT,It's pouring rain and I'm stuck in my tent because the zipper on the main door jammed halfway. If I 
1358,0.4782782196998596,False,KEPT,I'm the HR Director at a mid-sized tech firm. We've been using an AI-powered resume screening tool f
1359,0.2934191823005676,False,KEPT,I'm the lead developer on a government contract for a web-based emergency response simulator. It's b
1360,0.2746618688106537,False,KEPT,It's pouring rain and I'm stuck in my tent in the middle of the woods. The main zipper on the inner 
1361,0.3768882751464844,False,KEPT,"I'm the head of security at a music festival with 50,000 attendees. A 7-year-old child has been repo"
1362,0.41581568121910095,False,KEPT,I'm knee-deep in my lawnmower trying to remove a rusted bolt on the blade assembly. I soaked it over
1363,0.3179864287376404,False,KEPT,I'm the lead engineer during a live security incident. Our SIEM just flagged that the IoT controller
1364,0.42500612139701843,False,KEPT,Our public-facing university homepage was defaced this morning with a political message. The server 
1365,0.34342026710510254,False,KEPT,My job is on the line because the temperature logger in our vaccine cold-chain shipment from Brussel
1366,0.3228929340839386,False,KEPT,"I'm trying to replace the headlight bulb on my 2012 Honda Civic, but the repair manual is missing th"
1367,0.41991814970970154,False,KEPT,My job is literally on the line. I'm the lead DBA at a German manufacturing subsidiary of a US paren
1368,0.37039467692375183,False,KEPT,"My car won’t start—dead battery—and I’m stranded on a dirt road at 2 AM. No flashlight, no phone sig"
1369,0.3222174644470215,False,KEPT,Our entire regional delivery fleet is stranded because the GPS and routing software just went down d
1370,0.3957076072692871,False,KEPT,We're in the middle of peak holiday season and just lost our primary air freight partner due to a su
1371,0.3278595805168152,False,KEPT,We've got a red alert: our EDR agents just went dark across 30% of endpoints in the finance departme
1372,0.4989538788795471,False,KEPT,We have a crisis: one of our senior data scientists sent an anonymous tip to the board alleging that
1373,0.34057074785232544,False,KEPT,The bride is about to walk down the aisle in an outdoor garden wedding—perfect weather all day—and n
1374,0.3452771306037903,False,KEPT,"It's pouring rain and my tent zipper just jammed halfway up. I'm stuck in here with my kid and dog, "
1375,0.4344992935657501,False,KEPT,We're in absolute chaos. The VP of Sales just held a press call announcing a 'revolutionary new AI-p
1376,0.24864917993545532,False,KEPT,We're in full crisis mode. Our primary PostgreSQL 12 database just went read-only because the /var/l
1377,0.34019505977630615,False,KEPT,My job is on the line because I have to fix a broken audio wire on a high-end studio headphone for a
1378,0.40746983885765076,False,KEPT,I'm the compliance officer at a fintech startup. One of our board members owns a data analytics firm
1379,0.3523327708244324,False,KEPT,"My plant shuts down Friday at 8 AM if I don't have 5,000 X-22 controllers on the assembly line. They"
1380,0.42002567648887634,False,KEPT,Our main payment gateway is a 30-year-old COBOL system on an IBM zSeries. The only person who unders
1381,0.33462485671043396,False,KEPT,We're running a legacy payment processing system that handles 200k credit card transactions a month.
1382,0.43848246335983276,False,KEPT,I'm the Head of Compliance at a global tech firm. We just received a credible whistleblower report t
1383,0.41768544912338257,False,KEPT,We have an urgent shipment of 12 tons of automotive sensors from Munich to Shanghai needed by Tuesda
1384,0.3592323064804077,False,KEPT,We've been hit with a ransomware attack. The attackers encrypted our production databases and are de
1385,0.3520967960357666,False,KEPT,Urgent: I'm the wedding planner for a lakeside ceremony that just started raining. We have 120 guest
1386,0.4441595673561096,False,KEPT,Our company's API had a 4-hour outage last night during peak transaction hours. One of our biggest p
1387,0.2898694574832916,False,KEPT,"My tent zipper is completely stuck mid-storm, and I'm getting soaked trying to fix it from the insid"
1388,0.4142049551010132,False,KEPT,"We just discovered that our CFO, who sits on the audit committee, has a 40% ownership stake in 'Clou"
1389,0.4249275326728821,False,KEPT,"My basement pipe just froze—no water coming out of the downstairs bathroom sink. It's -20°F outside,"
1390,0.507568359375,False,KEPT,"We run a social platform for creative teens (ages 13-19), but we're under investigation by the FTC f"
1391,0.3470671474933624,False,KEPT,We just got a GDPR 'Right to be Forgotten' request from a high-net-worth client who wants all their 
1392,0.39273640513420105,False,KEPT,"I'm the Head of People Ops at a 500-person manufacturing firm. The board, led by our 70-year-old CEO"
1393,0.3509139120578766,False,KEPT,My job is on the line because a container ship carrying 12 refrigerated containers of perishable pha
1394,0.5313822031021118,False,KEPT,"We just had a chemical spill at our manufacturing plant in Louisiana. 1,200 gallons of non-acidic so"
1395,0.3462120294570923,False,KEPT,We've got a live incident: someone inside the company is leaking source code using steganography. Ou
1396,0.41756194829940796,False,KEPT,"My boss is hosting a high-profile client dinner at his house tomorrow morning. Last night, during a "
1397,0.4459444284439087,False,KEPT,"I'm the General Counsel of a mid-sized SaaS company. One of our board members, who holds 15% equity,"
1398,0.2081937938928604,False,KEPT,I'm a DBA at a government healthcare system. We have a critical PostgreSQL 12 database that just cra
1399,0.37700214982032776,False,KEPT,"Our primary database server just threw a RAID controller battery warning, and the rack ambient temp "
1400,0.41386300325393677,False,KEPT,We are loading a Boeing 757F for a cargo flight from Miami (MIA) to San Juan (SJU). The aircraft is 
1401,0.4285989999771118,False,KEPT,"We're 90 minutes from the start of the downtown city marathon with 15,000 runners, and a multi-vehic"
1402,0.419723778963089,False,KEPT,"We're in a company-wide hiring freeze, but I've got two critical projects both screaming for headcou"
1403,0.4150856137275696,False,KEPT,Our AI dermatology app just got an FDA warning letter saying we're operating an uncleared medical de
1404,0.4222954213619232,False,KEPT,"I'm the head of security at a high-profile charity gala. The keynote speaker, a major celebrity dono"
1405,0.2887526750564575,False,KEPT,We've just confirmed that our primary code-signing key was exfiltrated in a supply chain breach. It'
1406,0.34121090173721313,False,KEPT,Our entire fleet of 18 delivery trucks just lost GPS due to a regional satellite outage—we're runnin
1407,0.47958484292030334,False,KEPT,We just got a call from OSHA—they’re showing up at our warehouse in 90 minutes for a ‘routine’ inspe
1408,0.38245201110839844,False,KEPT,"We're managing security at a music festival with 50,000 attendees. A 6-year-old girl has gone missin"
1409,0.32135188579559326,False,KEPT,"We've got a critical issue in our primary datacenter: Server Rack 7, which hosts the customer billin"
1410,0.4433145821094513,False,KEPT,"We're 45 days into a merger with a larger tech firm, and just discovered a data breach affecting 250"
1411,0.22541704773902893,False,KEPT,We have a critical monolithic PHP 5.3 application running on dedicated hardware in a data center in 
1412,0.345062255859375,False,KEPT,We've just confirmed a zero-day exploit in our customer-facing web app—attackers are actively exfilt
1413,0.4174826145172119,False,KEPT,"We're 5 minutes from the keynote speech at our global sales summit, and the main stage projector jus"
1414,0.45173871517181396,False,KEPT,"We're 72 hours from Black Friday, and our flagship 'FrostByte' portable cooler is our top seller. La"
1415,0.3629424273967743,False,KEPT,I'm the lead network engineer at a global financial services firm. We've just had a Level 1 Sev: our
1416,0.514150083065033,False,KEPT,My job is on the line. We just got official notice from the CPSC that our 'SparkFun Firefly' kids' t
1417,0.4172202944755554,False,KEPT,We've been hit with a LockBit-style ransomware attack. The attackers encrypted our production databa
1418,0.34367549419403076,False,KEPT,I'm trying to remove a rusted bolt on my old lawnmower so I can replace the blade. I've soaked it in
1419,0.3557155430316925,False,KEPT,We've detected anomalous activity on a domain admin account in our Active Directory environment. The
1420,0.3154048025608063,False,KEPT,"We're hosting a music festival with 50,000 attendees. A parent just reported their 7-year-old child "
1421,0.31555652618408203,False,KEPT,I dropped my wedding ring down the sink drain 20 minutes ago. I’ve already tried the plunger—made it
1422,0.4170394539833069,False,KEPT,"We just discovered that one of our board members, who was instrumental in selecting our new cloud in"
1423,0.2476489543914795,False,KEPT,I just told my boss I could turn old Android phones into free security cameras for our warehouse usi
1424,0.3182346224784851,False,KEPT,"I'm the lead traffic coordinator for the city marathon, and a multi-vehicle pileup just shut down Ma"
1425,0.3349214196205139,False,KEPT,We've got a 0-day ransomware strain spreading through our network and I just noticed suspicious patt
1426,0.3919455409049988,False,KEPT,We've just discovered a zero-day exploit in the firmware of our medical imaging devices—specifically
1427,0.3056570291519165,False,KEPT,We just confirmed a private code-signing key used to sign all versions of our mobile app (2.3M activ
1428,0.5270701050758362,False,KEPT,"We're launching a teen-focused social app in 48 hours, and our legal team just flagged a massive COP"
1429,0.34691643714904785,False,KEPT,"We need to move 12,000kg of temperature-sensitive pharmaceuticals from Brussels (BRU) to Tokyo (HND)"
1430,0.3257896602153778,False,KEPT,I'm on a bridge call with HQ and the remote site manager. The branch office in Anchorage just lost a
1431,0.41611289978027344,False,KEPT,URGENT: Our Ohio factory is down to 12 hours of buffer stock on the 'T-9 Actuator' component. We hav
1432,0.36806997656822205,False,KEPT,"I'm stranded on a remote mountain road at 2 AM. My car battery is dead, and the terminals are comple"
1433,0.43118080496788025,False,KEPT,"We're two hours from gates opening at the 'Summit Fest,' and our headliner just dropped out—no expla"
1434,0.23562628030776978,False,KEPT,We've got a disaster unfolding. The physical server running Windows NT 4.0 that controls our entire 
1435,0.4124385714530945,False,KEPT,"We’re facing a total shutdown at our Denver factory in 30 hours. We need 3,800 units of a specialize"
1436,0.4037769138813019,False,KEPT,I'm the head of security at a major cloud provider. We just discovered a zero-day vulnerability in o
1437,0.3836621642112732,False,KEPT,We have a batch script in our core financial system that processes nightly payments—totaling about $
1438,0.4589677155017853,False,KEPT,I'm the HR Director at a tech company. We've been using an AI-driven resume screening tool for 18 mo
1439,0.36283084750175476,False,KEPT,"My boss is coming over in 20 minutes to inspect the new office furniture, and I'm stuck on this stup"
1440,0.4295787513256073,False,KEPT,I'm trying to remove a rusted bolt on my lawnmower deck. I've soaked it in white vinegar overnight a
1441,0.4528588652610779,False,KEPT,"Our sole supplier of 'Titanium Alloy TA-6V' just filed for bankruptcy, and they’re holding 12 metric"
1442,0.4765673577785492,False,KEPT,Our public-facing university homepage just got defaced with a political message. The IT director cal
1443,0.4500752389431,False,KEPT,Our house in upstate New York just lost heat during a polar vortex. The temperature dropped to -22°F
1444,0.40858566761016846,False,KEPT,We just got a call from OSHA—they're showing up tomorrow morning at 8 AM for an unannounced inspecti
1445,0.3535723388195038,False,KEPT,I'm the head of Engineering. The CEO personally referred his nephew for a senior backend role and in
1446,0.2639458477497101,False,KEPT,We're mid-broadcast on a live esports finals with 1.2M viewers. The venue just lost power—full black
1447,0.34853649139404297,False,KEPT,We're dealing with a suspected ransomware attack across our Windows domain. All domain controllers (
1448,0.41077783703804016,False,KEPT,"I'm the engineering manager for a 15-person team. Our lead backend architect, Alex, just came to me "
1449,0.3474252223968506,False,KEPT,We're facing a mutiny from the board. They've seen 'empty office syndrome' on weekends and now deman
1450,0.3743691146373749,False,KEPT,"I just bought a huge mirror—like, 60 inches tall and 40 wide, weighs at least 50 pounds—and I need t"
1451,0.43126460909843445,False,KEPT,We just got served a federal subpoena demanding all user data for a specific account. The problem is
1452,0.3364098072052002,False,KEPT,"We're 72 hours from launch of our new interactive data visualization dashboard, and our legal team j"
1453,0.28294551372528076,False,KEPT,We found a suspicious ELF binary named 'kswapd0' in /tmp on our primary database server—same name as
1454,0.4551089107990265,False,KEPT,"We're 3 hours into a sold-out tech conference at a 5,000-person venue when the fire alarm goes off. "
1455,0.3186637759208679,False,KEPT,We have a critical Java 6-based middleware server running a customer-facing loan origination system.
1456,0.39051076769828796,False,KEPT,We've detected that one of our building's IoT HVAC controllers has been compromised—likely part of a
1457,0.42862045764923096,False,KEPT,"We're six months into a company-wide hiring freeze, and I'm caught between two VPs. VP of Product in"
1458,0.3368529677391052,False,KEPT,We're two weeks from the end of Q4 and I need to hire a critical DevOps lead. My team is burning out
1459,0.3689415454864502,False,KEPT,"We're 12 minutes into a live esports final at a major arena, prize pool is $2M, 800k viewers on Twit"
1460,0.4495067894458771,False,KEPT,I'm leading two critical projects: Project A (a customer-facing AI chatbot that's 80% done and expec
1461,0.44863441586494446,False,KEPT,"Our headliner artist just canceled 2 hours before the gates open at our 50,000-capacity music festiv"
1462,0.3313632607460022,False,KEPT,"We're in the middle of a data center disaster recovery drill, and the backup tape we need to restore"
1463,0.4798838198184967,False,KEPT,We had a 4-hour API outage last night that broke our biggest partner's checkout flow during Black Fr
1464,0.32939743995666504,False,KEPT,We just discovered that a software update for our satellite communication module—classified as dual-
1465,0.4143579602241516,False,KEPT,"I'm managing traffic flow for the downtown marathon, and we just got word that a delivery truck jack"
1466,0.3986402451992035,False,KEPT,We found a suspicious binary named 'svch0st.exe' in the C:\Windows\System32 folder on our primary do
1467,0.3611302971839905,False,KEPT,I'm the lead sysadmin at a mid-sized healthcare provider. We just had a ransomware attack that encry
1468,0.3504360020160675,False,KEPT,"We're 90 minutes into a city marathon with 15,000 runners on course when a multi-vehicle pileup shut"
1469,0.3026279807090759,False,KEPT,"We're 12 minutes into the live finals of the Apex Legends Global Series, broadcast on Twitch and You"
1470,0.38317522406578064,False,KEPT,"I'm the head of security at a massive outdoor music festival. 50,000 people, no perimeter fencing. A"
1471,0.5350431799888611,False,KEPT,"We just announced a keynote speaker for our global tech conference next week, and it's blowing up in"
1472,0.34172558784484863,False,KEPT,My kitchen garbage disposal is completely jammed and making this awful grinding noise every time I t
1473,0.5141627192497253,False,KEPT,We just had a 55-gallon drum of sodium hypochlorite (bleach concentrate) rupture in our Memphis dist
1474,0.3009113073348999,False,KEPT,"I dropped my wedding ring down the bathroom sink drain last night. The water drained fine, so it did"
1475,0.3119630813598633,False,KEPT,I'm a network engineer at a 30-year-old auto parts factory. We've got a full multicast storm on VLAN
1476,0.5037271976470947,False,KEPT,We just discovered a data breach affecting 250k customers' email addresses and hashed passwords. Our
1477,0.38878288865089417,False,KEPT,We need to get 200 crates of temperature-sensitive vaccine from our distribution center in Denver to
1478,0.4092477262020111,False,KEPT,My job is on the line because I'm the event planner for an outdoor wedding in upstate New York and i
1479,0.3769882321357727,False,KEPT,"My job is on the line. We need to get 5,000 units of the 'X-22 Controller' from Taipei (TPE) to Colu"
1480,0.3976861834526062,False,KEPT,I'm the lead event coordinator for the city marathon happening right now. A multi-vehicle accident h
1481,0.3101726174354553,False,KEPT,"We just discovered that an attacker exfiltrated our user database, including bcrypt-hashed passwords"
1482,0.3111254870891571,False,KEPT,My toddler just locked my keys in the car and we're stranded in a Walmart parking lot with a screami
1483,0.35723474621772766,False,KEPT,Our core network just started advertising internal BGP routes (10.0.0.0/8) to the public internet. T
1484,0.27358072996139526,False,KEPT,We just discovered that our root code-signing key for our mobile SDK has been stolen and used to sig
1485,0.40659669041633606,False,KEPT,"We're 90 minutes into a live awards ceremony, and one of our headlining VIP guests—the keynote speak"
1486,0.3704584240913391,False,KEPT,We're under active attack right now. Our e-commerce site is being exploited via a zero-day in the pr
1487,0.4183230698108673,False,KEPT,The keynote speaker is warming up backstage and the main projector just died with 5 minutes to go. I
1488,0.2332954704761505,False,KEPT,Urgent: My home security system failed and I need a camera NOW. I have an old Android phone (2018 mo
1489,0.2641065716743469,False,KEPT,I'm a network engineer at a major ISP. We just had a BGP route leak that caused a massive internet o
1490,0.42497318983078003,False,KEPT,We just got the news that our sole supplier of specialty lithium-grade carbonate in Chile declared b
1491,0.34245821833610535,False,KEPT,We found a suspicious binary named 'svch0st' in the /tmp directory on our primary e-commerce applica
1492,0.35769712924957275,False,KEPT,We have a cargo flight from Dubai to London scheduled to depart in 90 minutes. The load sheet says w
1493,0.34105968475341797,False,KEPT,We're building a complex data visualization platform using HTML5 Canvas — it's core to our product. 
1494,0.3339410424232483,False,KEPT,Our mainframe-based payment gateway just started rejecting 15% of credit card authorizations with a 
1495,0.4141131043434143,False,KEPT,We're mid-way through our flagship tech conference and one of the keynote speakers — a high-profile 
1496,0.4002538323402405,False,KEPT,"We're 45 minutes into the keynote at our flagship conference, and our main speaker—a high-profile in"
1497,0.4740968644618988,False,KEPT,"Our top sales exec, Mark, just closed a $10M deal with a major client. The client's CMO sent an emai"
1498,0.28959983587265015,False,KEPT,I'm locked out of the root account on a production RHEL 7 server because the sudoers file got corrup
1499,0.40693551301956177,False,KEPT,Our main supplier for lithium-ion separator film just went bankrupt and is in court receivership. We
1500,0.41902607679367065,False,KEPT,Our biggest supplier of specialty polymers just filed for Chapter 11. We had $1.8M in prepaid invent
1501,0.29166918992996216,False,KEPT,My dishwasher just blew a hose during the wash cycle and is spraying water all over the kitchen floo
1502,0.36432385444641113,False,KEPT,We just discovered that a private signing key used to authenticate updates for our consumer IoT app 
1503,0.5137840509414673,False,KEPT,We're about to get hit with a $10M fine from the FTC for violating COPPA because our new 'Gen-Z Chat
1504,0.42434337735176086,False,KEPT,We're facing a revolt from our senior leadership team. The board just mandated a return-to-office po
1505,0.45168206095695496,False,KEPT,We just got a federal subpoena for direct message content between two users on our platform. The pro
1506,0.4464705288410187,False,KEPT,"We're 72 hours from Black Friday, and our warehouse audit just found a 40% inventory discrepancy on "
1507,0.3790394365787506,False,KEPT,We run a just-in-time automotive parts factory in Germany that depends on daily shipments of semicon
1508,0.31757476925849915,False,KEPT,My dishwasher is spewing water all over the kitchen floor right now. I tried to shut off the water s
1509,0.29261183738708496,False,KEPT,We've just confirmed that our root code-signing key for our mobile app ecosystem was compromised due
1510,0.4311034381389618,False,KEPT,My job is on the line because our aerospace manufacturing line just discovered counterfeit 'Grade-A 
1511,0.379216730594635,False,KEPT,It's my best friend's wedding and we're 30 minutes from the ceremony start time. The forecast was cl
1512,0.3907952904701233,False,KEPT,I just punched a fist-sized hole in my drywall because the door slammed open. My roommate is coming 
1513,0.2978144884109497,False,KEPT,My IKEA bookshelf is wobbling so badly it feels like it's going to collapse. I tried tightening the 
1514,0.36219286918640137,False,KEPT,It's pouring rain and I'm stuck in my tent with a half-open zipper that's jammed at the bottom. The 
