dpo_idx,max_similarity,ngram_match,status,text_snippet
0,0.3080615997314453,False,KEPT,I just dropped my wedding ring down the bathroom sink drain and I'm freaking out. I don't have a pip
1,0.33826565742492676,False,KEPT,I'm the wedding planner for an outdoor ceremony in Central Park. It was perfectly clear 45 minutes a
2,0.48518165946006775,False,KEPT,I'm a mid-level manager at a pharmaceutical company. I've uncovered that our clinical trial data for
3,0.4039689898490906,False,KEPT,We’ve got a confirmed data leak in our AI research division. Our DLP flagged a massive upload to a p
4,0.4326247572898865,False,KEPT,I'm the IT director at a regional hospital. We're 90 minutes into a ransomware attack that has encry
5,0.45893293619155884,False,KEPT,I've got a lawnmower that's been sitting in the shed for five years. The blade bolt is completely se
6,0.6967267990112305,False,REMOVED,"We just hosted a corporate gala for 300 VIP clients and executives. Within two hours, 42 attendees h"
7,0.3259740173816681,False,KEPT,I'm coordinating a 200-person outdoor wedding reception right now and it just started pouring rain. 
8,0.24859248101711273,False,KEPT,I'm locked out of the root account on a critical production RHEL 7 server because the sudoers file g
9,0.263916939496994,False,KEPT,I'm locked out of the root account on a critical production server running a legacy RHEL 6 system. T
10,0.44087696075439453,False,KEPT,I'm the lead event coordinator for the downtown city marathon happening right now. We just got a cal
11,0.408763587474823,False,KEPT,"We're 72 hours from a mandatory SOC 2 audit for our crypto exchange, and we just discovered a critic"
12,0.34655559062957764,False,KEPT,Our automotive plant in Germany runs on just-in-time delivery. The Suez Canal is blocked indefinitel
13,0.2930717468261719,False,KEPT,I just punched a softball-sized hole in my bedroom drywall because the door swung open too hard. It'
14,0.32718509435653687,False,KEPT,We're in a crisis: our 20-year-old manufacturing control system just started failing license checks 
15,0.36976420879364014,False,KEPT,We’re 48 hours from launch of our new interactive data visualization dashboard—a complex canvas-base
16,0.3623536229133606,False,KEPT,We are 90 minutes into a ransomware attack on our hospital's central patient database. The attackers
17,0.30230653285980225,False,KEPT,Our only router at the Anchorage field office just bricked itself during a failed auto-update. It's 
18,0.3176947236061096,False,KEPT,We’re in deep trouble. Our core customer portal is a PHP 5.3 monolith running on a single physical s
19,0.4760633111000061,False,KEPT,I'm the Head of HR Tech at a Fortune 500 company. We've been using an AI-driven resume screener for 
20,0.5497056841850281,False,KEPT,We just got blindsided by a CPSC (Consumer Product Safety Commission) alert: one of our best-selling
21,0.3888363838195801,False,KEPT,Urgent: I'm the wedding planner for an outdoor ceremony in Central Park. The couple just said their 
22,0.2882401943206787,False,KEPT,"We just discovered that an attacker exfiltrated our user database, including bcrypt-hashed passwords"
23,0.4005270004272461,False,KEPT,My job is on the line because I refused to prioritize the CEO's pet feature—'real-time emoji reactio
24,0.4631640315055847,False,KEPT,We just discovered a material misstatement in our Q3 financials 12 hours before the earnings call. T
25,0.4148736000061035,False,KEPT,We just discovered a zero-day vulnerability in our customer-facing banking API that allows unauthent
26,0.5433030724525452,False,KEPT,Our CEO just forwarded me a viral TikTok video from a customer who had a meltdown at our flagship st
27,0.4309050142765045,False,KEPT,My team spent three months building a client onboarding automation tool that just got demoed in the 
28,0.4297287166118622,False,KEPT,We have a critical batch script written in Perl that runs every hour to reconcile transaction totals
29,0.3553162217140198,False,KEPT,"I'm the Head of People Ops at a 1,200-person manufacturing firm. The board just demanded we bring ev"
30,0.369049608707428,False,KEPT,We've just received a federal subpoena for direct message content from a user on our encrypted messa
31,0.6682954430580139,False,REMOVED,"We just hosted a corporate gala dinner for 300 guests, including 15 members of the board and several"
32,0.3670632243156433,False,KEPT,We're 5 minutes from the keynote at our annual conference and the main projector just died—no signal
33,0.3476550877094269,False,KEPT,We've got a Level 1 incident: one of our smart HVAC controllers in the downtown office building is a
34,0.28518447279930115,False,KEPT,Our only physical connection to the Anchorage branch office just went down. The on-site technician d
35,0.2959060072898865,False,KEPT,I'm stuck in a tent in the middle of the woods and it's pouring rain. The main zipper on the rainfly
36,0.36276566982269287,False,KEPT,"I'm the operations lead at a medical device warehouse. We just discovered that 10,000 units of a Cla"
37,0.3849351108074188,False,KEPT,"We're 2 hours from opening the gates at our 50,000-person music festival, and our headliner just tex"
38,0.3480890095233917,False,KEPT,"We've detected anomalous SMB traffic in our network flow logs—specifically, hundreds of connections "
39,0.3350522518157959,False,KEPT,"We're operating a just-in-time automotive parts plant in Germany, and the Suez Canal is blocked—agai"
40,0.30705273151397705,False,KEPT,"We're under a live DDoS attack right now—the load balancer is getting hammered with 2.3M RPS, and ou"
41,0.37194523215293884,False,KEPT,We have a live incident: our SIEM flagged abnormal data uploads from a senior engineer's workstation
42,0.40473780035972595,False,KEPT,Our SOC just flagged anomalous outbound traffic from a Johnson Controls Metasys NAE-8000 HVAC contro
43,0.41271647810935974,False,KEPT,"We're 90 minutes into a live awards gala at a major tech conference, and one of our keynote speakers"
44,0.3467950224876404,False,KEPT,"We've detected anomalous login activity from an admin account at 3:17 AM UTC, originating from an IP"
45,0.36888086795806885,False,KEPT,"We're in the middle of a 3,000-person tech conference at the downtown convention center. The fire al"
46,0.4939103126525879,False,KEPT,"Our biggest client, a retail chain, just had a data breach traced back to a vulnerability in our SSO"
47,0.3826456367969513,False,KEPT,"We're 30 minutes into a packed tech keynote at a 5,000-person conference center when the fire alarm "
48,0.41328078508377075,False,KEPT,We're in the middle of a live ransomware attack on our hospital network. The patient database — incl
49,0.3945995569229126,False,KEPT,We're a cybersecurity firm that just discovered a zero-day exploit in a widely used industrial contr
50,0.25220367312431335,False,KEPT,Our backup system just failed a disaster recovery test. We're trying to restore critical financial r
51,0.39577433466911316,False,KEPT,Our CEO just clicked a phishing link and entered his credentials on a fake Microsoft 365 login page.
52,0.38443952798843384,False,KEPT,I'm leading a product team that's on the brink of collapse. We've been working 80-hour weeks for thr
53,0.37517672777175903,False,KEPT,My job is on the line. We've discovered counterfeit 'Voltage Regulator VR-7' chips in our inventory 
54,0.2910807430744171,False,KEPT,My garbage disposal is completely jammed and making this awful grinding noise every time I turn it o
55,0.403546005487442,False,KEPT,"We just confirmed a breach where attacker exfiltrated password hashes for all 10,000 users. We're 10"
56,0.27449360489845276,False,KEPT,My apartment was broken into last week and I'm freaking out. I want to set up a security camera righ
57,0.38229408860206604,False,KEPT,"We're at a massive music festival—50,000 people, packed fields, limited cell service. A 7-year-old g"
58,0.32278603315353394,False,KEPT,I'm hosting a dinner party and one of the table legs on my antique oak dining table just snapped at 
59,0.3768188953399658,False,KEPT,"We’re facing a critical parts shortage at our Denver manufacturing plant—3,000 units of a custom pow"
60,0.41744470596313477,False,KEPT,"We're in the middle of a company-wide hiring freeze, but I've got two VPs screaming for headcount: o"
61,0.397356241941452,False,KEPT,We just got served with a federal subpoena for user data from a messaging app we run. The problem is
62,0.3098059594631195,False,KEPT,We've just been alerted to a critical zero-day vulnerability in the Java 6 runtime used by our legac
63,0.49930340051651,False,KEPT,We're under investigation by the EEOC for our AI-powered hiring tool that disproportionately rejects
64,0.3154713809490204,False,KEPT,"We just confirmed a breach where an attacker exfiltrated our user database, including bcrypt-hashed "
65,0.5263500213623047,False,KEPT,We're under EEOC investigation for our AI-driven hiring tool that disproportionately rejects female 
66,0.2823275327682495,False,KEPT,"We're in a real bind. Our old document management system, which runs on a 2008 Windows Server we can"
67,0.3585462272167206,False,KEPT,We're hosting a dinner party and one of the legs on our antique dining table just cracked. It's wobb
68,0.25999170541763306,False,KEPT,I'm managing a legacy e-commerce site running on a monolithic PHP 5.3 codebase hosted on a single ph
69,0.39809688925743103,False,KEPT,We just got word the Suez Canal is blocked — again — and our container ship carrying $18M in critica
70,0.3138238191604614,False,KEPT,"My dishwasher just started gushing water onto the kitchen floor—like a steady stream, not just a dri"
71,0.320613831281662,False,KEPT,We've got a mission-critical inventory management system written in PowerBuilder back in 2003. The v
72,0.42991894483566284,False,KEPT,"I'm the warehouse operations lead for an e-commerce company. We're 48 hours from Black Friday, and o"
73,0.39155563712120056,False,KEPT,"We're two hours from gates opening at the Summer Sonic Festival, 50k people are in line, and our hea"
74,0.45587408542633057,False,KEPT,We just got a call from OSHA: they're showing up unannounced at our Houston fabrication plant in 4 h
75,0.42315399646759033,False,KEPT,"My lead AI engineer just told me she has a competing offer for $150k with stock options, but our sal"
76,0.378356397151947,False,KEPT,We have a refrigerated cargo ship (reefer vessel) carrying $8M in perishable pharmaceuticals en rout
77,0.35469871759414673,False,KEPT,We've just confirmed a zero-day exploit in our customer-facing web app. Attackers are actively probi
78,0.41073331236839294,False,KEPT,Our CEO clicked on a phishing link in an email that looked like it was from our legal counsel. The d
79,0.41406214237213135,False,KEPT,My job is on the line because I'm the wedding planner and it just started pouring rain at an outdoor
80,0.4572235345840454,False,KEPT,We just blew a major deadline for the Anderson account—the client that's run by the CEO's college ro
81,0.2781161367893219,False,KEPT,We're under a massive Layer 7 DDoS attack targeting our primary load balancer right now. Traffic is 
82,0.43949273228645325,False,KEPT,"We're 72 hours from Black Friday, and our flagship 'FrostByte Pro' blender is showing a 40% inventor"
83,0.35725149512290955,False,KEPT,We've confirmed a ransomware compromise on one of our IoT HVAC controllers at the downtown data cent
84,0.3538762331008911,False,KEPT,I'm a locksmith on a service call for a 2018 Honda Civic with the keys locked inside. My customer is
85,0.3366113305091858,False,KEPT,My kid just kicked a hole in the drywall near the bedroom door—about the size of a baseball. I don’t
86,0.3672454357147217,False,KEPT,We’re running a mission-critical inventory management system from 2003 that the original vendor aban
87,0.4396352767944336,False,KEPT,Our CEO just clicked on a phishing link that looked exactly like our internal Microsoft 365 login. H
88,0.2956200838088989,False,KEPT,"I'm setting up for a keynote at a tech conference, and the main projector just died 5 minutes before"
89,0.35704219341278076,False,KEPT,We're in full crisis mode. Our factory floor runs on a 20-year-old SCADA system written in VB6 with 
90,0.3762683868408203,False,KEPT,I'm the head of HR at a mid-sized tech firm. The CEO personally referred his son-in-law for a senior
91,0.58832848072052,False,REMOVED,"We're 90 minutes into a 500-person corporate gala dinner, and at least 30 guests have reported sever"
92,0.42059940099716187,False,KEPT,We've got a Level 1 SOC alert showing abnormal SMB traffic from a workstation in Accounting (10.20.3
93,0.3384554386138916,False,KEPT,We've detected suspicious lateral movement in our corporate network using only NetFlow logs—no EDR t
94,0.41003257036209106,False,KEPT,We're up against a hard deadline to renew our contract with 'CloudScale Inc.'—our primary SaaS platf
95,0.4304901659488678,False,KEPT,I'm the Head of Talent at a Fortune 500 tech company. The EEOC just opened an investigation into our
96,0.379762202501297,False,KEPT,I'm the lead traffic coordinator for the city marathon happening right now. We just got an emergency
97,0.35354018211364746,False,KEPT,We're stuck. Our shipment of 800kg of medical sensor modules is sitting in Singapore because the fre
98,0.35355108976364136,False,KEPT,"We had a security breach. An attacker exfiltrated our user database, which included bcrypt-hashed pa"
99,0.398750364780426,False,KEPT,We're two days from our PCI-DSS audit and just discovered our core payment processing server runs Wi
100,0.3658895492553711,False,KEPT,We had a ransomware attack last night. Our primary domain controller (DC) is encrypted and down. We 
101,0.36901232600212097,False,KEPT,"We had a full domain compromise last night. Attacker had Domain Admin, moved laterally, and we found"
102,0.45871269702911377,False,KEPT,We had a forklift tip over in our warehouse at 2 AM and rupture a 55-gallon drum of acetone-based so
103,0.41942107677459717,False,KEPT,I'm the VP of Engineering at a tech startup that just missed its Q3 revenue targets by 40%. Morale i
104,0.4023643732070923,False,KEPT,"I'm a senior analyst at a pharmaceutical company. Last week, I discovered that our lead oncology dru"
105,0.3535006046295166,False,KEPT,"CRITICAL: My job is on the line because we need to ship 5,000 units of the 'X-22 Controller' from Ta"
106,0.4299570322036743,False,KEPT,My job is on the line because I'm the lead developer on a complex canvas-based web app for a major u
107,0.4320855140686035,False,KEPT,Our AI-driven skin cancer detection app just got hit with an FDA warning letter stating we're operat
108,0.4122263789176941,False,KEPT,We just got a whistleblower email from an employee in our Jakarta subsidiary accusing the country ma
109,0.33857154846191406,False,KEPT,"We're in deep trouble. Our production monitoring system just crashed, and the only way to restart it"
110,0.4799598753452301,False,KEPT,"We're 48 hours from losing access to our CRM platform. Vendor X is our incumbent, but Legal just kil"
111,0.4626883566379547,False,KEPT,"We just found a 12,000-unit discrepancy in our flagship product inventory 72 hours before Black Frid"
112,0.4958166778087616,False,KEPT,"We just got a call from the CPSC: 50,000 units of our 'SmartBuddy' learning tablet for kids have a b"
113,0.47170066833496094,False,KEPT,We just got a whistleblower report from our Jakarta office alleging that our local sales director ap
114,0.3385535776615143,False,KEPT,We have 3 pallets of temperature-sensitive mRNA vaccines stuck at the Frankfurt airport customs sinc
115,0.37822821736335754,False,KEPT,"I'm the head of security at a music festival with 50,000 attendees. A 7-year-old child has been sepa"
116,0.31487584114074707,False,KEPT,"We're live on Twitch broadcasting a $500k prize LAN finals, and the venue just had a partial power o"
117,0.4384090006351471,False,KEPT,I'm the head of compliance at a crypto exchange. We have an unannounced audit tomorrow morning from 
118,0.32888370752334595,False,KEPT,"It's my best friend's wedding, and we're 30 minutes into the outdoor ceremony when the sky opens up."
119,0.38890618085861206,False,KEPT,We just found a suspicious binary named 'svch0st.exe' running under a low-privilege service account 
120,0.3100570738315582,False,KEPT,"My car won't start, battery is dead, and the terminals are crusty with white-green corrosion. It's 2"
121,0.3364511728286743,False,KEPT,We just confirmed a critical breach: an attacker exfiltrated our primary code-signing key from our H
122,0.3833557069301605,False,KEPT,"We have a shipment of 10,000 COVID-19 rapid test kits stuck at the Mexico City airport customs becau"
123,0.3426651954650879,False,KEPT,My manager just told me we have to deliver the Q4 analytics dashboard two weeks earlier than planned
124,0.3572835624217987,False,KEPT,It's -10°F outside and one of our bedroom windows is leaking cold air so bad the glass is frosting o
125,0.21102261543273926,False,KEPT,I'm locked out of the root account on a production RHEL 7 server because the sudoers file got corrup
126,0.37827399373054504,False,KEPT,I'm the compliance officer at a fintech startup. One of our board members is also the CEO of 'CloudS
127,0.43175968527793884,False,KEPT,"We have a refrigerated truck carrying 12,000 units of a temperature-sensitive mRNA vaccine stuck on "
128,0.4293477237224579,False,KEPT,My lead AI engineer just gave me an ultimatum: $50k raise or she walks in two weeks. She has a compe
129,0.34544873237609863,False,KEPT,My boss told me to seal a massive drafty basement window in this 100-year-old building using bubble 
130,0.32474714517593384,False,KEPT,We're 12 minutes into a live championship finals stream for a 500k prize pool esports tournament and
131,0.4093434810638428,False,KEPT,"We're 90 minutes into our annual tech gala, and the keynote speaker—a high-profile venture capitalis"
132,0.2679411768913269,False,KEPT,My boss just moved up the deadline for the Q4 sales analytics dashboard by two weeks—now due before 
133,0.660861074924469,False,REMOVED,"We just hosted a corporate gala for 200 VIP clients and senior executives. Within 3 hours, 42 people"
134,0.4334070384502411,False,KEPT,"My boss is coming over in 20 minutes to inspect the new office layout, and I just realized I mounted"
135,0.2770501375198364,False,KEPT,My job is on the line because I have to virtualize a physical Windows NT 4.0 server that controls ou
136,0.3394453823566437,False,KEPT,We had a ransomware attack last night. Our primary domain controller (DC) is encrypted and offline. 
137,0.37371590733528137,False,KEPT,I'm the lead engineer on a payroll processing system that runs on a 20-year-old AIX server. We just 
138,0.32266977429389954,False,KEPT,The payment gateway just stopped processing transactions at 2 AM. Our only COBOL developer quit with
139,0.507408857345581,False,KEPT,"We have a crisis: 10,000 units of our new 'BioGel' hand sanitizer just rolled off the line, but the "
140,0.3311024010181427,False,KEPT,I snapped a wire inside my expensive noise-canceling headphones and I need them for a client call to
141,0.4857293963432312,False,KEPT,Our largest supplier of specialty polymers just filed for Chapter 11 bankruptcy. They have 40 metric
142,0.2599577009677887,False,KEPT,I'm on-site at a nuclear power plant doing emergency maintenance. I need to secure an embedded contr
143,0.3999674618244171,False,KEPT,The VP of Sales just sent an all-hands email demanding we deliver the 'Customer 360' dashboard by Q3
144,0.3911418914794922,False,KEPT,My boss just called while I'm alone at the office during a cold snap. The basement water line is fro
145,0.4889467656612396,False,KEPT,We just got a call from OSHA—they're showing up at our warehouse in 90 minutes for a 'surprise' insp
146,0.3485054075717926,False,KEPT,My ceiling fan in the living room has started flickering like a horror movie prop and now it smells 
147,0.42468875646591187,False,KEPT,I'm the engineering manager for a 12-person team at a mid-sized tech company. One of my top performe
148,0.39422348141670227,False,KEPT,My dumbest mistake ever: spilled an entire bottle of Cabernet on my brand-new white living room carp
149,0.34339702129364014,False,KEPT,I'm the lead sysadmin at a manufacturing plant. We run a 20-year-old SCADA system on Windows XP embe
150,0.4320527911186218,False,KEPT,We have a surprise OSHA inspection at our manufacturing plant in 6 hours. The inspector is already o
151,0.4618367850780487,False,KEPT,I'm the General Counsel at a multinational. I just received a verified whistleblower report alleging
152,0.5129212141036987,False,KEPT,"We're 2 hours from gates opening at our 50,000-capacity 'Neon Horizon' music festival, and the headl"
153,0.36489391326904297,False,KEPT,"We're 36 hours from a line-down at our Denver plant. Missing 3,200 units of 'NX-7 Actuator'—critical"
154,0.3694525361061096,False,KEPT,We've detected anomalous activity on a domain admin account (User: 'svc_backup') that shows signs of
155,0.3659065365791321,False,KEPT,"The wedding is happening right now in a park, it just started pouring, and we have zero budget left "
156,0.4550204277038574,False,KEPT,We have a container with $2M worth of prototype AI hardware for our product launch next week that wa
157,0.44577479362487793,False,KEPT,"We have a fire alarm going off in a packed 3,000-person conference center during a keynote. The buil"
158,0.34917715191841125,False,KEPT,I'm the head of Engineering at a mid-sized tech firm. The CEO personally referred his nephew for a s
159,0.40408390760421753,False,KEPT,"We're hosting a high-profile industry gala at a luxury hotel, and a VIP guest—a well-known tech CEO—"
160,0.3867743909358978,False,KEPT,"We're 8 weeks into a 12-week project to build a custom CRM for a major client. Last week, the client"
161,0.24873381853103638,False,KEPT,My house got broken into last week. I need to set up a basic indoor security camera ASAP. I have an 
162,0.2477063089609146,False,KEPT,"We're down to 48 hours before the physical server room gets decommissioned, and I just found out the"
163,0.41427791118621826,False,KEPT,"We have a refrigerated cargo ship (reefer vessel) carrying 10,000 pallets of fresh strawberries from"
164,0.31350091099739075,False,KEPT,We just discovered that our primary code-signing certificate (used for all mobile and desktop app up
165,0.4385026693344116,False,KEPT,"I'm the compliance officer at a fintech startup. We just discovered that one of our board members, w"
166,0.37799394130706787,False,KEPT,We just discovered a zero-day vulnerability in our government-facing SaaS platform that handles clas
167,0.4348811209201813,False,KEPT,We just got hit with a Class I recall notice from the CPSC for our 'SparkleBot' kids' robot toy. Tur
168,0.3527502715587616,False,KEPT,I'm a director at a fintech company in the middle of a company-wide hiring freeze and 15% budget cut
169,0.35084593296051025,False,KEPT,I'm the lead developer on a complex data visualization dashboard built with a canvas-based rendering
170,0.28059789538383484,False,KEPT,My job is on the line because we've got a critical CVE-2023-28834 vulnerability in our Java 6-based 
171,0.39611268043518066,False,KEPT,I need to convince our CTO to sunset a legacy reporting dashboard he personally built 8 years ago. I
172,0.5038255453109741,False,KEPT,We've got a live production deadlock in the 'KontoTransaktionen' table on our old SAP R/3 system. Th
173,0.4205843210220337,False,KEPT,"We're under a live credential stuffing attack on our customer portal—over 200,000 login attempts in "
174,0.3228645324707031,False,KEPT,I'm hosting a dinner party and one of the legs on my antique dining table just snapped at the base. 
175,0.40527740120887756,False,KEPT,"We're live-streaming a major tech conference with 50K people watching globally. Our keynote speaker,"
176,0.3870198726654053,False,KEPT,"Our CEO is pushing for a full return-to-office mandate by Q3, saying 'culture can't be built on Zoom"
177,0.28829053044319153,False,KEPT,We just received a valid GDPR 'Right to be Forgotten' request from a customer who was also a directo
178,0.335818886756897,False,KEPT,"We're managing security for a music festival with 50,000 attendees. A 7-year-old boy has gone missin"
179,0.3543926477432251,False,KEPT,Our just-in-time automotive plant in Germany is on the brink of a line-down in 72 hours. We're missi
180,0.32073086500167847,False,KEPT,I locked my keys in my 2018 Honda Civic and I'm stranded in a grocery store parking lot. Towing will
181,0.4331953525543213,False,KEPT,We're under a massive credential stuffing attack on our customer portal right now. The login endpoin
182,0.32214272022247314,False,KEPT,We're running a critical inventory management system from 2003 that the original vendor dissolved in
183,0.4737285375595093,False,KEPT,We just had a 55-gallon drum of hydrofluoric acid (HF) rupture in our distribution center in Phoenix
184,0.3197613060474396,False,KEPT,"My boss just demanded I deliver the 'Project Phoenix' feature by Friday, even though my team is burn"
185,0.39930930733680725,False,KEPT,"We're in a company-wide hiring freeze, but I've got two mission-critical projects both screaming for"
186,0.38673973083496094,False,KEPT,We discovered a zero-day vulnerability in our enterprise SaaS platform that’s being actively exploit
187,0.34665870666503906,False,KEPT,We've got a confirmed breach in our cloud environment. Our EDR agent failed to catch the initial com
188,0.4349093735218048,False,KEPT,"We pre-paid $1.2M for a critical batch of specialty polymers from our sole supplier, PolyNova. They "
189,0.3256923258304596,False,KEPT,"We need to sunset our internal 'Nexus' API gateway—a clunky, 7-year-old homegrown system that's cost"
190,0.35383617877960205,False,KEPT,URGENT: I'm putting together one of those flat-pack bookshelves and the middle shelf is already wobb
