dpo_idx,max_similarity,ngram_match,status,text_snippet
3771,0.37313830852508545,False,KEPT,"I'm trying to assemble this IKEA bookshelf, but the middle screw is completely stripped—head is chew"
3772,0.31685560941696167,False,KEPT,I'm in the middle of a downpour on a solo backpacking trip in the Cascades. My tent's main zipper ju
3773,0.3441866338253021,False,KEPT,We've got a critical server rack in our primary data center that's been overheating for 72 hours—coo
3774,0.42392951250076294,False,KEPT,"We have a shipment of 10,000 doses of a temperature-sensitive antivenom stuck at the Mexico City (ME"
3775,0.43705248832702637,False,KEPT,Our AI-powered mental health chatbot just got an FDA warning letter saying it's an uncleared Class I
3776,0.3709937632083893,False,KEPT,"We're 90 minutes from the start of the city marathon, and a multi-vehicle pileup has completely bloc"
3777,0.439805269241333,False,KEPT,We just got served with a federal subpoena for direct message content between two users on our encry
3778,0.30555200576782227,False,KEPT,Our manufacturing line is down because the legacy SCADA system (no longer supported) just started en
3779,0.4942195415496826,False,KEPT,We just discovered a critical bug in the reporting module of our SaaS platform that caused incorrect
3780,0.31957200169563293,False,KEPT,Our production monitoring system just went dark because the license for the proprietary log parser (
3781,0.35376718640327454,False,KEPT,We just got a GDPR 'Right to be Forgotten' request from a customer who also happens to be a former e
3782,0.358266681432724,False,KEPT,"We're in a company-wide hiring freeze, but I'm leading two mission-critical projects: Project Atlas "
3783,0.27303460240364075,False,KEPT,My dishwasher is spewing water all over the kitchen floor right now. I tried to turn off the water s
3784,0.43231773376464844,False,KEPT,My job is on the line because I have to fix a critical audio feed for a live broadcast in 20 minutes
3785,0.4650358259677887,False,KEPT,"We just announced a keynote speaker for our tech conference next month, and it's blowing up on Twitt"
3786,0.4139215052127838,False,KEPT,We just got served with a federal subpoena for user data from our encrypted messaging app. The probl
3787,0.2603064775466919,False,KEPT,Our remote branch in Anchorage just lost all network connectivity. The on-site technician says the r
3788,0.2382344901561737,False,KEPT,We're in full outage. Our primary PostgreSQL 12 instance on an old Ubuntu 18.04 VM just crashed with
3789,0.32365888357162476,False,KEPT,We're building a real-time collaborative design tool using HTML5 Canvas — think Figma meets Miro — a
3790,0.40413904190063477,False,KEPT,"We're 72 hours from a FINRA audit on our crypto exchange, and I just found out our transaction log s"
3791,0.33292049169540405,False,KEPT,We're 12 hours past the ransomware deadline. The attackers just upped the stakes — they've started d
3792,0.32450389862060547,False,KEPT,My job is on the line because I'm trying to virtualize a physical Windows NT 4.0 server that control
3793,0.3033103346824646,False,KEPT,I'm out camping in the Rockies and it's pouring rain. My tent zipper is completely jammed halfway up
3794,0.3913237452507019,False,KEPT,Our entire regional delivery fleet is stranded on highways because the central GPS routing system we
3795,0.3736593723297119,False,KEPT,"My boss is filming a cooking segment for the company's new food line, and I'm the on-set kitchen tec"
3796,0.5000714063644409,False,KEPT,We just got a lab report back on the 'SparkleBot' kids' robot toy — it fails CPSC flammability stand
3797,0.4078253507614136,False,KEPT,We've started finding counterfeit 'ThermalShield X1' heat sinks in our assembly line. They look almo
3798,0.45171964168548584,False,KEPT,I'm the head of legal at a messaging startup. We just got served with a federal subpoena demanding t
3799,0.44472643733024597,False,KEPT,"We're in the middle of a tech conference with 1,200 people packed into a single ballroom. The fire a"
3800,0.48679041862487793,False,KEPT,We're in full crisis mode. Our core ERP system just locked up because two batch jobs are deadlocked 
3801,0.3972397744655609,False,KEPT,We're under a massive credential stuffing attack right now. Attackers are using known email/password
3802,0.3618762791156769,False,KEPT,"We've discovered counterfeit X-22 Controller chips in our inventory, and they're making it into fina"
3803,0.31247130036354065,False,KEPT,"I'm the lead architect on a critical migration project, and my job is on the line. We need to deprec"
3804,0.4025808572769165,False,KEPT,Our AI mental health chatbot just got hit with an FDA warning letter stating it's an uncleared medic
3805,0.3627030551433563,False,KEPT,I'm the head of engineering at a tech startup. The CEO personally referred his nephew for a senior b
3806,0.3964177370071411,False,KEPT,I'm a senior engineer leading a 6-person team. We spent 3 months developing a new real-time fraud de
3807,0.3895770311355591,False,KEPT,We've detected anomalous login behavior on our primary domain admin account—logins from an unexpecte
3808,0.34168756008148193,False,KEPT,We just confirmed a supply chain compromise in our CI/CD pipeline. The 'log-utils' package our front
3809,0.3881343901157379,False,KEPT,We've just confirmed a zero-day exploit in our public-facing customer portal (written in Node.js) th
3810,0.30359283089637756,False,KEPT,"We just lost our GPS fleet tracking system due to a satellite outage, and I'm responsible for gettin"
3811,0.4405458867549896,False,KEPT,"I'm the engineering manager for a 15-person team. Our lead architect, Sarah, just gave me an ultimat"
3812,0.26401999592781067,False,KEPT,I'm a junior sysadmin and I messed up. I was editing the /etc/sudoers file on our primary Ubuntu ser
3813,0.4311240315437317,False,KEPT,"I'm the head of security at a tech conference with 3,000 attendees in a packed downtown convention c"
3814,0.4626404047012329,False,KEPT,"We just announced a keynote speaker for our tech conference, and it's blowing up on Twitter/X. The s"
3815,0.39193078875541687,False,KEPT,"We're having our monthly all-hands meeting tomorrow, and I know there's a rumor spreading like wildf"
3816,0.5426925420761108,False,KEPT,"We just announced a keynote speaker for our tech conference next month, and it's blowing up. Turns o"
3817,0.3244236409664154,False,KEPT,My job is on the line because the container with our prototype hardware for next week's product laun
3818,0.3723018765449524,False,KEPT,"My car won’t start and I’m completely stranded on a dirt road at 2 AM. The battery is dead, the term"
3819,0.34578150510787964,False,KEPT,My job is on the line because the AS/400 mainframe froze during a critical batch run and the physica
3820,0.35372433066368103,False,KEPT,We just got a formal GDPR 'Right to be Forgotten' request from a customer who used our fintech app 5
3821,0.3688156008720398,False,KEPT,We've detected suspicious lateral movement in our internal network using flow logs. The SOC team see
3822,0.34448733925819397,False,KEPT,I'm managing a pharmaceutical cold-chain shipment from Munich to Singapore. The reefer container's o
3823,0.39910322427749634,False,KEPT,I'm a product manager at a mid-sized tech company. My engineering lead just sent me a message saying
3824,0.2964910566806793,False,KEPT,I'm a data protection officer at a fintech startup in Berlin. We just got a valid GDPR 'Right to be 
3825,0.3227418065071106,False,KEPT,I'm the AV lead for a major tech conference. The main stage projector just died 5 minutes before the
3826,0.23738017678260803,False,KEPT,We're in a full-blown production crisis. Our primary PostgreSQL 12 instance just crashed during a hi
3827,0.33821815252304077,False,KEPT,Our Head of Product just demanded we fast-track the 'AI Voice Assistant' feature for the next releas
3828,0.48509201407432556,False,KEPT,I'm the HR Tech Director at a national retail chain. We rolled out an AI resume screener last year t
3829,0.3540405333042145,False,KEPT,We just got hit with a supply chain attack. One of our core third-party libraries—'AuthLib v4.2'—was
3830,0.31413906812667847,False,KEPT,Our CEO clicked on a phishing link in an email that looked like it came from the CFO. The device is 
3831,0.4082910120487213,False,KEPT,"We're in a company-wide hiring freeze, but I've got two VPs screaming for headcount: one needs a sen"
3832,0.40400823950767517,False,KEPT,"Our hospital's patient database just got hit with ransomware—entire EHR system is locked, and the at"
3833,0.39930784702301025,False,KEPT,"CRITICAL: Our Ohio factory is going line-down in 36 hours unless we get 5,000 units of the 'X-22 Con"
3834,0.3088783919811249,False,KEPT,"We're two days from launch of our new data visualization dashboard, which is built entirely in HTML5"
3835,0.4703643321990967,False,KEPT,We just announced a keynote speaker for our tech conference next month—a prominent AI ethicist known
3836,0.37382638454437256,False,KEPT,"My job is on the line because I'm supposed to assemble a bookshelf for the CEO's office, but the scr"
3837,0.3572457432746887,False,KEPT,I'm the incident response lead at a defense contractor. We've confirmed that someone with privileged
3838,0.3248755931854248,False,KEPT,"We had a breach. An attacker exfiltrated our user database, including salted SHA-256 password hashes"
3839,0.4349580705165863,False,KEPT,Our CEO just clicked on a phishing email that installed a remote access trojan. The security team co
3840,0.2236034870147705,False,KEPT,My job is on the line because the router at our remote Alaska field office has bricked itself after 
3841,0.3953554630279541,False,KEPT,"I'm the head of security at a massive music festival with 50,000 people. A 7-year-old boy has just g"
3842,0.3279944062232971,False,KEPT,"We're running a C++ monitoring daemon on a legacy RHEL 5.11 system (yes, it's ancient) that's been s"
3843,0.3716748356819153,False,KEPT,We just discovered a breach where an attacker exfiltrated our user database containing bcrypt-hashed
3844,0.31259801983833313,False,KEPT,"We just discovered that one of our code-signing keys, used to sign updates for 12 million deployed d"
3845,0.4097345769405365,False,KEPT,My job is on the line because I have to deliver the news that we missed a critical deadline on a pro
3846,0.3351096510887146,False,KEPT,"My job is literally on the line. We're in the middle of peak holiday season, all air freight capacit"
3847,0.3827943205833435,False,KEPT,"We're having our monthly all-hands meeting in 30 minutes and just this morning, a Slack rumor explod"
3848,0.23957636952400208,False,KEPT,My job is on the line because I have to virtualize a physical Windows NT 4.0 server that runs our fa
3849,0.36290138959884644,False,KEPT,We're doing a critical data recovery from a 15-year-old LTO-5 tape drive that hasn't been powered on
3850,0.40646493434906006,False,KEPT,Our AI-driven skin cancer detection app just got hit with an FDA warning letter stating we're operat
3851,0.4397231936454773,False,KEPT,"We're mid-day at a 3,000-person tech conference in a downtown convention center when the fire alarm "
3852,0.39770132303237915,False,KEPT,I'm the HR Director at a mid-sized tech firm. We've been using an AI resume screener for two years. 
3853,0.4316004514694214,False,KEPT,We have a critical delivery of insulin to a hospital in rural Montana. The shipment is sitting at ou
3854,0.35136908292770386,False,KEPT,"We are 2 hours from opening the gates at the Sunset Sound Festival, and our headliner just texted th"
3855,0.3640190362930298,False,KEPT,"We just had a security breach where an attacker exfiltrated our user database, including bcrypt-hash"
3856,0.3031790554523468,False,KEPT,Our entire regional trucking fleet just lost GPS due to a solar flare knocking out satellite signals
3857,0.3641703426837921,False,KEPT,My job is on the line because the COBOL payment gateway just crashed and we're losing $12k per minut
3858,0.39938533306121826,False,KEPT,Our main supplier of specialty capacitors just filed for Chapter 11 bankruptcy. They have $1.27M wor
3859,0.41746437549591064,False,KEPT,I'm the Head of People Ops at a 500-person manufacturing firm. Our CEO and 3 out of 5 board members 
3860,0.462851881980896,False,KEPT,"We just lost a major deliverable deadline for a client project, and the CEO is furious. The problem "
3861,0.35070133209228516,False,KEPT,Our entire fleet of 12 delivery trucks lost GPS connectivity this morning due to a regional satellit
3862,0.525578498840332,False,KEPT,I'm the Head of Talent at a Fortune 500 tech company. The EEOC just opened an investigation into our
3863,0.3712497353553772,False,KEPT,I'm the wedding planner for an outdoor ceremony in Central Park. The bride's family just flew in fro
3864,0.3796226680278778,False,KEPT,We've been hit with a ransomware attack. The attackers encrypted our production databases and are de
3865,0.4660370349884033,False,KEPT,"We're 45 days into a high-profile merger with a fintech competitor, and the integration team just di"
3866,0.3459426164627075,False,KEPT,"Our automotive plant in Germany runs on a just-in-time model, and 80% of our critical 'Type-G' trans"
3867,0.3347545862197876,False,KEPT,"I just pulled a muscle in my wrist and can't grip well, but I'm starving and need to open this jar o"
3868,0.3905795216560364,False,KEPT,"We just got a call from our offshore platform manager: the main turbine on Rig 7 failed at 3 AM, and"
3869,0.4008077383041382,False,KEPT,My job is on the line. I need to hire a senior cybersecurity analyst for our incident response team 
3870,0.4143037497997284,False,KEPT,My job is literally on the line. We had a 12-hour API outage last night that took down our biggest p
3871,0.44148439168930054,False,KEPT,I'm the warehouse manager at a chemical distribution center. We just had a 55-gallon drum of 'Acid-X
3872,0.42646536231040955,False,KEPT,We just got the lab report back: our 'SkyRocket' flying toy fails CPSC safety standards due to exces
3873,0.38457217812538147,False,KEPT,"My job is on the line because I have to present a remote-work policy to the board next week, and eve"
3874,0.6412328481674194,False,REMOVED,"We just hosted a corporate gala for 300 VIP clients and senior execs. Within 90 minutes of dinner, 4"
3875,0.39266178011894226,False,KEPT,My job is on the line because I need to retrieve a wedding ring that fell down the sink drain in a r
3876,0.44606098532676697,False,KEPT,"We're in the middle of renewing our $1.2M annual contract with our cloud analytics vendor, and thing"
3877,0.37143826484680176,False,KEPT,We're 14 days away from closing a $400M acquisition by a major tech firm. The due diligence is compl
3878,0.42265447974205017,False,KEPT,We're 3 hours into a major tech conference at a downtown convention center when the fire alarm goes 
3879,0.3668791651725769,False,KEPT,We just confirmed a successful spear-phishing attack on our CEO. The attacker got full access to her
3880,0.32116514444351196,False,KEPT,We're having a full-blown multicast storm on the factory floor network right now. The PLCs are timin
3881,0.44086652994155884,False,KEPT,We just got a whistleblower report via our ethics hotline alleging that our subsidiary in Vietnam ha
3882,0.3381229043006897,False,KEPT,We just got internal intelligence that one of our core third-party dependencies — 'AuthLib v4.2' — h
3883,0.49588826298713684,False,KEPT,I just discovered that a major product feature we promised to deliver next month for our biggest cli
3884,0.4961913228034973,False,KEPT,I'm the plant manager at a chemical facility in Louisiana. We just had a small but detectable leak o
3885,0.28930771350860596,False,KEPT,We have a critical industrial control system (ICS) in our water treatment plant that runs on an embe
3886,0.3471561074256897,False,KEPT,"We're facing a massive holiday backlog at all major cargo hubs. Our shipment of 3,000 'NexaChip' mic"
3887,0.4130702614784241,False,KEPT,My basement pipe just froze last night — it's a 3/4-inch copper supply line running along the founda
3888,0.5163190364837646,False,KEPT,We had a chemical spill last night at our small manufacturing plant — 300 gallons of acetone leaked 
3889,0.4407123327255249,False,KEPT,Our public-facing university homepage just got defaced with a political message and a fake ransom no
3890,0.38091421127319336,False,KEPT,"My dishwasher is leaking like a sieve under the sink—water’s everywhere, and I can’t find the shut-o"
3891,0.37537628412246704,False,KEPT,I'm the head of security at a power grid operator. We just discovered a zero-day exploit in our Siem
3892,0.36569005250930786,False,KEPT,I'm in full incident mode: our production PostgreSQL 12 database just crashed because the primary in
3893,0.4547455906867981,False,KEPT,My job is on the line because I have to explain a data breach to our customers — tomorrow we're anno
3894,0.3910490870475769,False,KEPT,"I'm a senior product manager. My direct report, a junior analyst, spent three months building a cust"
3895,0.3348214328289032,False,KEPT,My garbage disposal just started making a loud grinding noise and won’t drain. I need to fix it NOW 
3896,0.44477739930152893,False,KEPT,My job is on the line because I'm supposed to be the 'cleaning expert' on this home renovation reali
3897,0.3811073899269104,False,KEPT,My job is on the line because we've discovered counterfeit X-22 controller chips entering our supply
3898,0.3331209719181061,False,KEPT,"My job is on the line. I'm the only sysadmin on-site during a holiday weekend, and one of our critic"
3899,0.4304552376270294,False,KEPT,I'm the engineering manager caught between two VPs. VP of Product wants me to reassign two of my sen
3900,0.33593639731407166,False,KEPT,"We're 18 minutes into a live esports final at a major convention center, and the entire stage just w"
3901,0.39795881509780884,False,KEPT,"We're 15 minutes into the keynote at our global sales conference, and the CEO just handed the mic to"
3902,0.3008311688899994,False,KEPT,My garbage disposal is completely jammed and making this terrifying grinding noise when I turn it on
3903,0.29628607630729675,False,KEPT,My toilet has been running non-stop for hours and I finally figured out the flapper chain is broken 
3904,0.4409381151199341,False,KEPT,We've got a critical alert from our SIEM: one of the IoT thermostats in the HVAC system on Floor 12 
3905,0.41685163974761963,False,KEPT,"The headliner for our 40,000-capacity 'Summit Sound Festival' just dropped out — literally. Lead sin"
3906,0.4858570098876953,False,KEPT,"We just announced a keynote speaker for our tech conference next month, and it's blowing up in our f"
3907,0.40588873624801636,False,KEPT,Our VP of Engineering just sent a company-wide email demanding that the 'Project Atlas' launch be mo
3908,0.3409268856048584,False,KEPT,My job is on the line because my boss's wedding ring just slipped off his finger and vanished into t
3909,0.32600563764572144,False,KEPT,We've just confirmed a zero-day RCE (Remote Code Execution) exploit in our customer-facing web app. 
3910,0.36398017406463623,False,KEPT,We've discovered a zero-day vulnerability in a widely used industrial control system (ICS) that coul
3911,0.36109673976898193,False,KEPT,We're loading a 757 freighter in Anchorage for a critical medevac resupply flight to a remote Alaska
3912,0.44464653730392456,False,KEPT,"We are down to 18 hours before production stops in Detroit. We have 3,000 units of a critical sensor"
3913,0.40753746032714844,False,KEPT,My boss just told me we have to be WCAG 2.1 AA compliant by end of week or we lose a major governmen
3914,0.40775272250175476,False,KEPT,I just spilled an entire bottle of red wine on my white living room carpet during a Zoom call with i
3915,0.28755873441696167,False,KEPT,My job is literally on the line. I'm trying to restore critical financial data from a 20-year-old LT
3916,0.4040515422821045,False,KEPT,One of my top engineers just got a competing offer for 40% more than she makes now. She's not active
3917,0.3596169054508209,False,KEPT,We just had a junior DBA accidentally run a DROP SCHEMA CASCADE on our production PostgreSQL 9.6 ins
3918,0.3889292776584625,False,KEPT,Our public-facing website just got defaced. Homepage shows a hacker message: 'You're owned. Patch fa
3919,0.35872507095336914,False,KEPT,"My toddler just locked herself in the car, it's 90 degrees outside, and I only have a wire coat hang"
3920,0.3037315905094147,False,KEPT,"Urgent: My dishwasher is leaking like a sieve—water’s pooling on the kitchen floor, and I just reali"
3921,0.35684168338775635,False,KEPT,My basement pipe froze overnight and it's supposed to drop to -20°F again tonight. If it doesn't tha
3922,0.43183451890945435,False,KEPT,"I'm the VP of Engineering at a mid-sized tech company. We just had our all-hands meeting, and halfwa"
3923,0.3171612620353699,False,KEPT,"It's 2 AM, pouring rain, and my tent zipper is jammed halfway up — I can't close it and water is sta"
3924,0.29715996980667114,False,KEPT,Our primary branch office in Anchorage just lost all connectivity. The on-site tech tried to upgrade
3925,0.32904815673828125,False,KEPT,"We're two years into our hybrid work policy, and it's been a disaster with the old guard on the boar"
3926,0.48731669783592224,False,KEPT,My job is on the line. I need to get a critical delivery of pharmaceuticals from our warehouse in De
3927,0.39086806774139404,False,KEPT,"We're 90 minutes from the start of the city's annual marathon—10,000 runners, streets shut down, TV "
3928,0.3954784870147705,False,KEPT,Our company's API went down for 47 minutes this morning during peak trading hours for our financial 
3929,0.4204868972301483,False,KEPT,"We just had a 20% headcount reduction in the product engineering org, and now we have to delay the f"
3930,0.4838189482688904,False,KEPT,I'm the Head of HR at a tech firm. We've been using an AI-powered resume screener for two years that
3931,0.4183981716632843,False,KEPT,We found a suspicious binary called 'svch0st.exe' in the Windows\Temp folder on our primary database
3932,0.2592310309410095,False,KEPT,"My garbage disposal just started making this horrible grinding noise when I turn it on, and now it w"
3933,0.515830934047699,False,KEPT,"We've got a five-star hotel chain, and a guest just posted a viral TikTok video with 2M views trashi"
3934,0.39711979031562805,False,KEPT,We are 3 hours into a production line stoppage because a critical microchip (ATM90E32) we've used fo
3935,0.43336302042007446,False,KEPT,"We're organizing a tech innovation summit, and we just announced a keynote speaker who's a well-know"
3936,0.4914003312587738,False,KEPT,We run a social media app for teens and just got hit with a formal FTC inquiry under COPPA. They're 
3937,0.5083158016204834,False,KEPT,"I'm a mid-level manager at a pharmaceutical plant. For the last three months, I've been trying to re"
3938,0.34032776951789856,False,KEPT,We have a critical situation: one of our smart HVAC controllers in the downtown office building has 
3939,0.42231887578964233,False,KEPT,Our refrigerated cargo ship 'MV Horizon' is carrying $8M worth of temperature-sensitive pharmaceutic
3940,0.37940943241119385,False,KEPT,My job is on the line right now because I'm responsible for the load distribution of a cargo flight 
3941,0.3628827929496765,False,KEPT,We've got a critical server rack in our data closet that's been running 10°F hotter than normal for 
3942,0.39021095633506775,False,KEPT,Our public-facing WordPress site just got defaced with a ransom note: 'Pay 5 BTC or we leak your cus
3943,0.4025426208972931,False,KEPT,"URGENT: Our Ohio production line is going to halt in 48 hours unless we get 5,000 X-22 Controller un"
3944,0.4024311304092407,False,KEPT,My job is on the line because I need to thaw a frozen pipe in the basement before it bursts—right no
3945,0.420112282037735,False,KEPT,"My top AI engineer just got a competing offer for $30K more. She's not actively leaving, but she sho"
3946,0.2957521975040436,False,KEPT,We just confirmed our root code-signing certificate was stolen in a supply chain breach. Attackers h
3947,0.4365386366844177,False,KEPT,We just got a call—OSHA is showing up at our warehouse in 2 hours for an unannounced inspection. The
3948,0.35178202390670776,False,KEPT,My toilet is flooding the bathroom because the flapper won't seal — the chain snapped clean off and 
3949,0.3213244080543518,False,KEPT,My director just announced in a team meeting that our 'Client Insight Dashboard' project deadline ha
3950,0.3158857524394989,False,KEPT,My toilet keeps running nonstop and I finally figured out the flapper chain is broken — it's just da
3951,0.3720226287841797,False,KEPT,We're 5 minutes from the keynote speech at our biggest conference of the year. The main stage projec
3952,0.49679380655288696,False,KEPT,I'm a mid-level compliance officer at a Fortune 500 pharma company. We've uncovered internal data sh
3953,0.6256965398788452,False,REMOVED,"I'm managing a corporate gala for 500 guests when 42 people suddenly report nausea, vomiting, and di"
3954,0.34915173053741455,False,KEPT,"We're facing an imminent SEC audit for our crypto exchange, and we just discovered a critical gap: o"
3955,0.4723488688468933,False,KEPT,I'm the plant manager at a chemical manufacturing facility. OSHA just called — they're sending an in
3956,0.5285635590553284,False,KEPT,"We just announced a keynote speaker for our tech ethics conference, and it's blowing up on Twitter. "
3957,0.38092517852783203,False,KEPT,"Our refrigerated cargo ship 'Ocean Freezer 7' is currently 12 hours from port in Savannah, Georgia, "
3958,0.24534228444099426,False,KEPT,We're under a massive DDoS attack right now—the load balancer is getting hammered with 2.5 Tbps of j
